{
  "schema_version": "0.1",
  "system": { "url": "https://example-poor-ds.com", "name": "Poor DS", "version": null },
  "coverage": {
    "pages_found": 6,
    "pages_retrieved": 6,
    "pages_failed": 0,
    "components_detected": 3,
    "components_evaluated": 3,
    "crawl_limited": false,
    "evaluation_status": "COMPLETE"
  },
  "access": {
    "documentation_recoverability": "NOT_RECOVERABLE",
    "component_index": "NONE",
    "props_types_accessibility": "NAMES_ONLY",
    "structured_tokens": "NOT_RECOVERABLE",
    "types_or_schema": "NONE",
    "agent_manifest": "NONE",
    "agent_interface": "NONE"
  },
  "evidence": [],
  "components": [
    { "name": "Button", "props": [], "variants": [], "states": [], "usage": {}, "composition": [], "code_examples_count": 0, "executable_examples_count": 0, "evidence_ids": [] },
    { "name": "Card", "props": [], "variants": [], "states": [], "usage": {}, "composition": [], "code_examples_count": 0, "executable_examples_count": 0, "evidence_ids": [] },
    { "name": "Modal", "props": [], "variants": [], "states": [], "usage": {}, "composition": [], "code_examples_count": 0, "executable_examples_count": 0, "evidence_ids": [] }
  ],
  "tokens": [],
  "foundations": [],
  "patterns": [],
  "manifests": [],
  "schemas": [],
  "accessibility": [],
  "documentation": {
    "components_documented": 0,
    "components_with_code_examples": 0,
    "components_with_executable_examples": 0,
    "components_with_variants_states_explained": 0,
    "versioning_present": false
  },
  "contradictions": [],
  "metadata": { "tokens_status": "NOT_FOUND" }
}
