{
  "schema_version": "0.1",
  "system": { "url": "https://example-good-ds.com/design-system", "name": "Good DS", "version": "4.2.0" },
  "coverage": {
    "pages_found": 40,
    "pages_retrieved": 38,
    "pages_failed": 2,
    "components_detected": 4,
    "components_evaluated": 4,
    "crawl_limited": false,
    "evaluation_status": "COMPLETE"
  },
  "access": {
    "documentation_recoverability": "FULLY_RECOVERABLE",
    "component_index": "COMPLETE",
    "props_types_accessibility": "PROPS_TYPES_AND_VALUES",
    "structured_tokens": "COMPLETE",
    "types_or_schema": "COMPLETE",
    "agent_manifest": "COMPLETE",
    "agent_interface": "PRESENT"
  },
  "evidence": [
    { "id": "ev-1", "source": "https://example-good-ds.com/components/button", "location": "Button > API", "content": "Button accepts variant primary|secondary|ghost", "type": "component_api", "component": "Button", "section": "API", "version": "4.2.0", "retrieval_method": "html", "confidence": 1.0, "status": "FOUND" }
  ],
  "components": [
    {
      "name": "Button",
      "source": "https://example-good-ds.com/components/button",
      "description": "Triggers an action.",
      "props": [
        { "name": "variant", "type": "string", "allowed_values": ["primary", "secondary", "ghost"], "default": "primary", "description": "Visual style tied to action importance.", "evidence_ids": ["ev-1"] },
        { "name": "disabled", "type": "boolean", "allowed_values": null, "default": false, "description": "Prevents interaction when the action cannot currently be performed.", "evidence_ids": ["ev-1"] }
      ],
      "variants": ["primary", "secondary", "ghost"],
      "states": [
        { "name": "hover", "status": "FOUND" },
        { "name": "disabled", "status": "FOUND" },
        { "name": "loading", "status": "FOUND" }
      ],
      "usage": {
        "purpose": "Triggers a single, immediate action.",
        "when_to_use": "Use primary for the main action on a screen.",
        "when_not_to_use": "Do not use ghost for destructive actions.",
        "competing_components": [],
        "disambiguation_rules": [],
        "restrictions": ["Never stack two primary buttons in the same view."]
      },
      "composition": [],
      "accessibility": { "keyboard": true, "aria": true },
      "code_examples_count": 3,
      "executable_examples_count": 2,
      "evidence_ids": ["ev-1"]
    },
    {
      "name": "Modal",
      "props": [
        { "name": "size", "type": "string", "allowed_values": ["sm", "md", "lg"], "default": "md", "description": "Controls modal width.", "evidence_ids": [] }
      ],
      "variants": ["sm", "md", "lg"],
      "states": [{ "name": "open", "status": "FOUND" }],
      "usage": {
        "purpose": "Interrupts the flow to demand a decision or show critical content.",
        "when_to_use": "Use Modal when the user must respond before continuing.",
        "when_not_to_use": "Do not use Modal for non-blocking confirmations of destructive actions; use AlertDialog.",
        "competing_components": ["Drawer"],
        "disambiguation_rules": ["Use Modal for blocking decisions; use Drawer for supplementary, non-blocking content."],
        "restrictions": ["Do not nest Modal inside Modal."]
      },
      "composition": ["Header", "Body", "Footer"],
      "accessibility": { "keyboard": true, "aria": true },
      "code_examples_count": 2,
      "executable_examples_count": 1,
      "evidence_ids": []
    },
    {
      "name": "Drawer",
      "props": [
        { "name": "position", "type": "string", "allowed_values": ["left", "right"], "default": "right", "description": "Side the drawer slides from.", "evidence_ids": [] }
      ],
      "variants": ["left", "right"],
      "states": [{ "name": "open", "status": "FOUND" }],
      "usage": {
        "purpose": "Shows supplementary content alongside the main view without blocking it.",
        "when_to_use": "Use Drawer for filters, settings, or secondary content.",
        "when_not_to_use": "Do not use Drawer when the user must make a blocking decision.",
        "competing_components": ["Modal"],
        "disambiguation_rules": ["Use Drawer for non-blocking supplementary content; use Modal for blocking decisions."],
        "restrictions": []
      },
      "composition": ["Header", "Body"],
      "accessibility": { "keyboard": true, "aria": true },
      "code_examples_count": 1,
      "executable_examples_count": 1,
      "evidence_ids": []
    },
    {
      "name": "Alert",
      "props": [
        { "name": "variant", "type": "string", "allowed_values": ["info", "warning", "error", "success"], "default": "info", "description": "Severity of the message.", "evidence_ids": [] }
      ],
      "variants": ["info", "warning", "error", "success"],
      "states": [],
      "usage": {
        "purpose": "Communicates a persistent, inline status message.",
        "when_to_use": "Use error for validation failures that block form submission; use warning for non-blocking risks.",
        "when_not_to_use": "Do not use Alert for transient confirmations; use Toast instead.",
        "competing_components": ["Toast", "Banner"],
        "disambiguation_rules": ["Alert = persistent inline. Toast = transient, auto-dismissing. Banner = page-level, persistent."],
        "restrictions": []
      },
      "composition": [],
      "accessibility": { "aria": true },
      "code_examples_count": 2,
      "executable_examples_count": 2,
      "evidence_ids": []
    }
  ],
  "tokens": [
    { "name": "blue.500", "type": "color", "value": "#3B82F6", "category": "primitive", "alias_of": null, "mode": null, "intent": null, "evidence_ids": [] },
    { "name": "color.action.primary", "type": "color", "value": "#3B82F6", "category": "semantic", "alias_of": "blue.500", "mode": "light", "intent": "Used for primary calls to action, not for links.", "evidence_ids": [] },
    { "name": "color.text.primary", "type": "color", "value": "#111111", "category": "semantic", "alias_of": "gray.900", "mode": "light", "intent": "Used for primary body text.", "evidence_ids": [] },
    { "name": "space.inset.md", "type": "spacing", "value": "16px", "category": "semantic", "alias_of": "space.4", "mode": null, "intent": "Default internal padding for cards and panels.", "evidence_ids": [] },
    { "name": "font.size.body", "type": "typography", "value": "14px", "category": "semantic", "alias_of": null, "mode": null, "intent": "Default body copy size.", "evidence_ids": [] },
    { "name": "radius.md", "type": "radius", "value": "8px", "category": "semantic", "alias_of": null, "mode": null, "intent": null, "evidence_ids": [] }
  ],
  "foundations": [],
  "patterns": [
    { "name": "Form field", "components": ["Label", "Input", "ErrorMessage"], "nesting_rules": "Label > Input > ErrorMessage", "layout": "vertical stack, 4px gap" }
  ],
  "manifests": [{ "type": "AGENTS.md", "url": "https://example-good-ds.com/AGENTS.md" }],
  "schemas": [{ "type": "d.ts", "url": "https://example-good-ds.com/types.d.ts" }],
  "accessibility": [],
  "documentation": {
    "components_documented": 4,
    "components_with_code_examples": 4,
    "components_with_executable_examples": 4,
    "components_with_variants_states_explained": 3,
    "versioning_present": true
  },
  "contradictions": [],
  "metadata": { "tokens_status": "FOUND" }
}
