{
  "schema_version": "0.1",
  "system": { "url": "https://example-partial-ds.com/ds", "name": "Partial DS", "version": "1.0.0" },
  "coverage": {
    "pages_found": 50,
    "pages_retrieved": 18,
    "pages_failed": 32,
    "components_detected": 20,
    "components_evaluated": 6,
    "crawl_limited": false,
    "evaluation_status": "COMPLETE"
  },
  "access": {
    "documentation_recoverability": "PARTIAL",
    "component_index": "PARTIAL",
    "props_types_accessibility": "PARTIAL",
    "structured_tokens": "PARTIAL",
    "types_or_schema": "NONE",
    "agent_manifest": "NONE",
    "agent_interface": "NONE"
  },
  "evidence": [],
  "components": [
    {
      "name": "Button",
      "props": [{ "name": "variant", "type": "string", "allowed_values": ["primary", "secondary"], "default": "primary", "description": null, "evidence_ids": [] }],
      "variants": ["primary", "secondary"],
      "states": [],
      "usage": { "purpose": "Triggers an action.", "when_to_use": null, "when_not_to_use": null, "competing_components": [], "disambiguation_rules": [], "restrictions": [] },
      "composition": [],
      "code_examples_count": 1,
      "executable_examples_count": 0,
      "evidence_ids": []
    },
    { "name": "Input", "props": [], "variants": [], "states": [], "usage": {}, "composition": [], "code_examples_count": 0, "executable_examples_count": 0, "evidence_ids": [] },
    { "name": "Select", "props": [], "variants": [], "states": [], "usage": {}, "composition": [], "code_examples_count": 0, "executable_examples_count": 0, "evidence_ids": [] },
    { "name": "Checkbox", "props": [], "variants": [], "states": [], "usage": {}, "composition": [], "code_examples_count": 0, "executable_examples_count": 0, "evidence_ids": [] },
    { "name": "Radio", "props": [], "variants": [], "states": [], "usage": {}, "composition": [], "code_examples_count": 0, "executable_examples_count": 0, "evidence_ids": [] },
    { "name": "Switch", "props": [], "variants": [], "states": [], "usage": {}, "composition": [], "code_examples_count": 0, "executable_examples_count": 0, "evidence_ids": [] }
  ],
  "tokens": [
    { "name": "blue-500", "type": "color", "value": "#3B82F6", "category": "primitive", "alias_of": null, "mode": null, "intent": null, "evidence_ids": [] }
  ],
  "foundations": [],
  "patterns": [],
  "manifests": [],
  "schemas": [],
  "accessibility": [],
  "documentation": {
    "components_documented": 2,
    "components_with_code_examples": 1,
    "components_with_executable_examples": 0,
    "components_with_variants_states_explained": 0,
    "versioning_present": false
  },
  "contradictions": [],
  "metadata": { "tokens_status": "FOUND" }
}
